Thème Énergétique,Count
Actualités économiques et environnementales,22
Emploi et dynamique économique,111
Emploi et formation dans le secteur de l'énergie,19
Enjeux mondiaux et émissions de gaz à effet de serre,66
Financement et développement public,33
Innovation dans le secteur de l'énergie,69
Interviews médias et déclarations de la ministre de l'industrie,54
Politique énergétique en Allemagne,92
Politique énergétique et environnementale,85
Production d'énergie et transition énergétique,43
Recherche et développement dans l'industrie énergétique,35
Stratégies économiques et environnementales,28
"Énergie nucléaire, électricité et économie industrielle",40
Énergie renouvelable et développement international,31
"Énergie solaire, éolienne en France et dans le monde",88
